{
    "project_info": {
        "project_platform": "Pypi",
        "project_owner": "numpy",
        "project_name": "numpy",
        "project_release": "v1.22.1",
        "project_year": 2021
    },
    "gh_data_points": [
        "gh_contributor_count",
        "gh_user_count",
        "gh_total_download_count",
        "gh_release_download_count",
        "gh_yearly_commit_count",
        "gh_repository_language",
        "gh_open_issues_count",
        "gh_zero_response_issues_count",
        "gh_issue_ratio",
        "gh_average_resolution_time",
        "gh_owner_stargazer_count"
    ],
    "lib_data_points": [
        "lib_release_frequency",
        "lib_contributor_count",
        "lib_dependency_count",
        "lib_dependent_count",
        "lib_latest_release_date",
        "lib_first_release_date",
        "lib_release_count",
        "lib_sourcerank"
    ],
    "cve_data_points": [
        "cve_count",
        "cve_vulnerabilities",
        "cve_codes"
    ],
    "so_data_points": [
        "so_popularity"
    ],
    "virus_scanning": [
        "virus_ratio"
    ]
}